{
  "template": "prematch_prediction",
  "match": "Punjab Kings vs Mumbai Indians",
  "public_team": "Punjab Kings",
  "model_pick": "Punjab Kings",
  "probability": 52,
  "reasons": [
    "Toss: Mumbai Indians chose to bowl",
    "Punjab Kings stayed 52 percent favourite",
    "No major move after toss context update"
  ],
  "cta": "Join Telegram for full picks before toss."
}
